{"$schema":"https://json-schema.org/draft/2020-12/schema","$id":"https://thedailyline.bet/schemas/video/v1/script-package.schema.json","title":"ScriptPackage","type":"object","additionalProperties":false,"required":["schema_version","script_id","video_story_id","creative_variant_id","segments","total_word_count","estimated_duration_ms","language","script_generator_ref","prompt_template_ref","model_ref","created_at","script_digest"],"properties":{"schema_version":{"const":"script-package.v1"},"script_id":{"$ref":"common.schema.json#/$defs/Id"},"video_story_id":{"$ref":"common.schema.json#/$defs/Id"},"creative_variant_id":{"$ref":"common.schema.json#/$defs/Id"},"segments":{"type":"array","minItems":1,"items":{"$ref":"#/$defs/ScriptSegment"}},"total_word_count":{"type":"integer","minimum":0},"estimated_duration_ms":{"type":"integer","minimum":0},"language":{"type":"string","minLength":2},"script_generator_ref":{"$ref":"common.schema.json#/$defs/Ref"},"prompt_template_ref":{"$ref":"common.schema.json#/$defs/Ref"},"model_ref":{"$ref":"common.schema.json#/$defs/Ref"},"created_at":{"$ref":"common.schema.json#/$defs/Timestamp"},"script_digest":{"$ref":"common.schema.json#/$defs/Digest"}},"$defs":{"ScriptSegment":{"type":"object","additionalProperties":false,"required":["segment_id","scene_id","text","segment_type","claim_refs","fact_refs","explanation_refs","protected_tokens","allow_paraphrase"],"properties":{"segment_id":{"$ref":"common.schema.json#/$defs/Id"},"scene_id":{"$ref":"common.schema.json#/$defs/Ref"},"text":{"type":"string","minLength":1},"segment_type":{"enum":["hook","narration","transition","pick_reveal","CTA","disclaimer","brand"]},"claim_refs":{"$ref":"common.schema.json#/$defs/RefSet"},"fact_refs":{"$ref":"common.schema.json#/$defs/RefSet"},"explanation_refs":{"$ref":"common.schema.json#/$defs/RefSet"},"protected_tokens":{"type":"array","items":{"$ref":"common.schema.json#/$defs/ProtectedToken"}},"allow_paraphrase":{"type":"boolean"},"non_factual_language":{"type":"boolean","default":false}}}}}
