{"schema_version":"script-package.v1","script_id":"script.mlb.sf-lad.1a","video_story_id":"story.mlb.sf-lad.20260908.1","creative_variant_id":"creative.mlb.sf-lad.20260908.1a","segments":[{"segment_id":"seg.hook","scene_id":"scene.hook","text":"The model has San Francisco at 61.8% tonight.","segment_type":"hook","claim_refs":["claim.model-edge"],"fact_refs":["fact.model-prob"],"explanation_refs":[],"protected_tokens":[{"token_id":"tok.model-prob","source_ref":"fact.model-prob","source_value":"0.618","render_value":"61.8%","normalization_rule_ref":"probability-display.v1","match_policy":"EXACT"}],"allow_paraphrase":true,"non_factual_language":false},{"segment_id":"seg.reason","scene_id":"scene.reason","text":"That compares with a 54.2% market-implied probability.","segment_type":"narration","claim_refs":["claim.model-edge"],"fact_refs":["fact.market-prob"],"explanation_refs":["explanation.model-vs-market"],"protected_tokens":[{"token_id":"tok.market-prob","source_ref":"fact.market-prob","source_value":"0.542","render_value":"54.2%","normalization_rule_ref":"probability-display.v1","match_policy":"EXACT"}],"allow_paraphrase":true,"non_factual_language":false},{"segment_id":"seg.pick","scene_id":"scene.pick","text":"The approved play is SF ML.","segment_type":"pick_reveal","claim_refs":["claim.pick"],"fact_refs":["fact.pick"],"explanation_refs":[],"protected_tokens":[{"token_id":"tok.pick","source_ref":"fact.pick","source_value":"SF ML","render_value":"SF ML","normalization_rule_ref":"text-verbatim.v1","match_policy":"EXACT"}],"allow_paraphrase":false,"non_factual_language":false},{"segment_id":"seg.outro","scene_id":"scene.outro","text":"The Daily Line. See the data. Find the edge.","segment_type":"brand","claim_refs":[],"fact_refs":[],"explanation_refs":[],"protected_tokens":[],"allow_paraphrase":false,"non_factual_language":true}],"total_word_count":31,"estimated_duration_ms":15000,"language":"en-US","script_generator_ref":"fixture-generator.v1","prompt_template_ref":"single-pick-script.v1","model_ref":"fixture/no-llm","created_at":"2026-09-08T16:05:00Z","script_digest":"sha256:8632327934e57ad2093f5f167c3dfaf588a4fc566f3e3260c377b6cb27432d64"}
